{
  "schema": "ADworkflo.architecture_manifest.v1",
  "configured": false,
  "created_at": null,
  "project_size": "unknown",
  "classification_source": "product_docs_empty",
  "expected_complexity_score": 0,
  "context_strategy": "architecture-first",
  "execution_mode": "solo",
  "analysis_basis": [],
  "source_hashes": {},
  "detected_signals": {},
  "planned_modules": [],
  "suggested_modules": [],
  "data_stores": [],
  "agent_features": [],
  "risk_areas": [],
  "recommended_artifacts": [],
  "recommended_next_actions": []
}
